{
  "schemaVersion": 1,
  "id": "mutual-a:unit:alpha",
  "version": "1.0.0",
  "title": "Alpha",
  "durationMinutes": 5,
  "outcomes": [
    { "id": "alpha", "do": "说明 Alpha", "bloom": "understand", "evidence": "口头复述" }
  ],
  "prerequisites": [],
  "pages": [
    { "id": "mutual-a:page:alpha", "path": "slides/01.html", "estimatedMinutes": 5, "role": "concept" }
  ],
  "cases": [],
  "assets": []
}
